Release Date,Season,Episode,Episode Title,Name,Sentence,Unique Coding
2011-04-17,Season 1,Episode 1,Winter is Coming,theon greyjoy,"It's for the queen, I bet. I hear she's [sleek as a mink?]",Politics
2011-05-01,Season 1,Episode 3,Lord Snow,petyr baelish,"But we have a Kingdom to look after. I've hoped to meet you for some time, Lord Stark. No doubt Lady Catelyn has mentioned me.",Politics
2011-05-01,Season 1,Episode 3,Lord Snow,petyr baelish,We are the lords of small matters here.,Politics
2011-05-01,Season 1,Episode 3,Lord Snow,petyr baelish,I'm telling you the Crown is six million in debt.,Politics
2011-05-08,Season 1,Episode 4,"Cripples, Bastards and Broken Things",petyr baelish,"He never stops. Do you know Ser Hugh of the Vale? Not surprising. Until recently, he was only a squire... Jon Arryn's squire. He was knighted almost immediately after his master's untimely death.",Politics
2011-05-08,Season 1,Episode 4,"Cripples, Bastards and Broken Things",theon greyjoy,He's not my master.,Politics
2011-05-15,Season 1,Episode 5,The Wolf and the Lion,petyr baelish,"Strictly speaking, such a thing would not be in accordance with the King's laws.",Politics
2011-05-15,Season 1,Episode 5,The Wolf and the Lion,petyr baelish,Council business. We all have so much to discuss with Ned Stark.,Politics
2011-05-15,Season 1,Episode 5,The Wolf and the Lion,petyr baelish,One shudders at the thought.,Politics
2011-05-15,Season 1,Episode 5,The Wolf and the Lion,theon greyjoy,Important enough for the likes of you.,Politics
2011-05-15,Season 1,Episode 5,The Wolf and the Lion,theon greyjoy,I've been Lord Stark's ward since I was eight years old.,Politics
2011-05-22,Season 1,Episode 6,A Golden Crown,petyr baelish,Fish. The sigil of House Tully. Isn't that your wife's House - Tully - my Lord Hand?,Politics
2011-05-29,Season 1,Episode 7,You Win or You Die,petyr baelish,My Lord protector.,Politics
2011-05-29,Season 1,Episode 7,You Win or You Die,petyr baelish,So when the King dies...,Politics
2011-05-29,Season 1,Episode 7,You Win or You Die,petyr baelish,And he cannot take the throne without your help.,Politics
2011-05-29,Season 1,Episode 7,You Win or You Die,petyr baelish,You are now Hand of the King and Protector of the Realm.,Politics
2011-05-29,Season 1,Episode 7,You Win or You Die,sam tarly,"my lord, might I go as well?",Politics
2011-05-29,Season 1,Episode 7,You Win or You Die,sam tarly,"No, my lord.",Politics
2011-06-19,Season 1,Episode 10,Fire and Blood,petyr baelish,"And what would you do, my friend, if you found yourself sitting up there?",Politics
2011-06-19,Season 1,Episode 10,Fire and Blood,petyr baelish,But you carry on whispering in one king's ear and then the next. l admire you.,Politics
2012-04-01,Season 2,Episode 1,The North Remembers,petyr baelish,Your Grace.,Politics
2012-04-01,Season 2,Episode 1,The North Remembers,petyr baelish,"Of course, Your Grace.",Politics
2012-04-01,Season 2,Episode 1,The North Remembers,theon greyjoy,"A word, Your Grace?",Politics
2012-04-01,Season 2,Episode 1,The North Remembers,theon greyjoy,It's not so bad once you get used to it.,Politics
2012-04-08,Season 2,Episode 2,The Night Lands,theon greyjoy,A man. Your blood and your heir.,Politics
2012-04-08,Season 2,Episode 2,The Night Lands,theon greyjoy,What's done is done. I've brought you a proposal from Robb Stark.,Politics
2012-04-15,Season 2,Episode 3,What Is Dead May Never Die,petyr baelish,"With a single stroke, you'd make me one of the greatest lords in the realm.",Politics
2012-04-15,Season 2,Episode 3,What Is Dead May Never Die,petyr baelish,The Queen mustn't know.,Politics
2012-04-22,Season 2,Episode 4,Garden of Bones,petyr baelish,Your Grace.,Politics
2012-04-22,Season 2,Episode 4,Garden of Bones,petyr baelish,"No, my lady.",Politics
2012-04-22,Season 2,Episode 4,Garden of Bones,petyr baelish,The Lannisters will trade your daughters for the Kingslayer.,Politics
2012-04-29,Season 2,Episode 5,The Ghost of Harrenhal,petyr baelish,"He was, Your Grace.",Politics
2012-04-29,Season 2,Episode 5,The Ghost of Harrenhal,petyr baelish,Do you want to be a queen?,Politics
2012-04-29,Season 2,Episode 5,The Ghost of Harrenhal,theon greyjoy,I do. Your captain.,Politics
2012-04-29,Season 2,Episode 5,The Ghost of Harrenhal,theon greyjoy,Thank you. Kind of you to come see me off.,Politics
2012-05-06,Season 2,Episode 6,The Old Gods and the New,petyr baelish,Lord Tywin.,Politics
2012-05-06,Season 2,Episode 6,The Old Gods and the New,petyr baelish,The Tyrells have not yet declared for any of the surviving kings. Loras wants revenge. He blames Stannis for Renly's death. And Margaery-,Politics
2012-05-06,Season 2,Episode 6,The Old Gods and the New,petyr baelish,"If you will allow me to represent your family's interests, I believe that an advantageous agreement TYWIN",Politics
2012-05-06,Season 2,Episode 6,The Old Gods and the New,theon greyjoy,My father has donned the ancient crown of Salt and Rock and declared himself King of the Iron Islands. He claims the North as well by right of conquest. You are all his subjects.,Politics
2012-05-06,Season 2,Episode 6,The Old Gods and the New,theon greyjoy,I am the Lord of Winterfell as Bran just informed you. Send the ravens.,Politics
2012-05-06,Season 2,Episode 6,The Old Gods and the New,theon greyjoy,"Ser Rodrik, it grieves me that we meet as foes.",Politics
2012-05-06,Season 2,Episode 6,The Old Gods and the New,theon greyjoy,"Among them, but not one of them. I was his hostage, taken from my home.",Politics
2012-05-06,Season 2,Episode 6,The Old Gods and the New,theon greyjoy,"You've served this house faithfully, old man. But keep talking and I'll-",Politics
2012-05-06,Season 2,Episode 6,The Old Gods and the New,theon greyjoy,"I'm a prince now, and you'd do well-",Politics
2012-05-13,Season 2,Episode 7,A Man Without Honor,theon greyjoy,"If there are any who still question whether your new lord means what he says, here is the answer to your question.",Politics
2012-06-03,Season 2,Episode 10,Valar Morghulis,petyr baelish,My lady. My sincerest condolences.,Politics
2013-03-31,Season 3,Episode 1,Valar Dohaeris,petyr baelish,You said King's Landing was your home. You are the property of the crown. Stealing you would be treason. If you were to tell just one person ...,Politics
2013-04-14,Season 3,Episode 3,Walk of Punishment,petyr baelish,Titles do seem to breed titles.,Politics
2013-04-14,Season 3,Episode 3,Walk of Punishment,petyr baelish,I know. But how would the queen get that idea?,Politics
2013-04-14,Season 3,Episode 3,Walk of Punishment,theon greyjoy,I'll make you a Lord of the Iron Islands for this.,Politics
2013-04-28,Season 3,Episode 5,Kissed by Fire,petyr baelish,Your Grace.,Politics
2013-04-28,Season 3,Episode 5,Kissed by Fire,petyr baelish,"Of course, Your Grace.",Politics
2013-04-28,Season 3,Episode 5,Kissed by Fire,petyr baelish,I see. And have you shared these suspicions with Lord Tywin?,Politics
2013-05-05,Season 3,Episode 6,The Climb,petyr baelish,The realm? Do you know what the realm is? It's the thousand blades of Aegon's enemies. A story we agree to tell each other over and over till we forget that it's a lie.,Politics
2013-05-05,Season 3,Episode 6,The Climb,theon greyjoy,He was your brother. Your father is Lord Rickard Karstark.,Politics
2014-04-13,Season 4,Episode 2,The Lion and the Rose,theon greyjoy,"A fine shot, master. My lady.",Politics
2014-04-13,Season 4,Episode 2,The Lion and the Rose,theon greyjoy,"I'm sorry, my lord.",Politics
2014-04-27,Season 4,Episode 4,Oathkeeper,petyr baelish,Did I kill Joffrey? I've been in the Vale for weeks.,Politics
2014-05-04,Season 4,Episode 5,First of His Name,petyr baelish,My lord.,Politics
2014-05-11,Season 4,Episode 6,The Laws of Gods and Men,theon greyjoy,"Yes, of course, my lord.",Politics
2014-06-01,Season 4,Episode 8,The Mountain and the Viper,theon greyjoy,I was born on Pike to Balon Greyjoy. His third and last-living son. I am your prince. I swear it by the drowned god. What is dead may never die.,Politics
2014-06-01,Season 4,Episode 8,The Mountain and the Viper,theon greyjoy,Lord Bolton took me captive after Winterfell. He sent me to treat with you in good faith as your fellow Ironborn.,Politics
2014-06-01,Season 4,Episode 8,The Mountain and the Viper,theon greyjoy,"My own father, your king, surrendered years ago to Robert Baratheon. I watched him bend the knee. There was no shame there. He fought with honor, as did you.",Politics
2015-04-12,Season 5,Episode 1,The Wars to Come,petyr baelish,"Lord Royce may be as honorable as he thinks he is, but he's not alone in that castle. Do you trust all those knights and ladies, stable boys and serving girls?",Politics
2015-04-12,Season 5,Episode 1,The Wars to Come,sam tarly,If Ser Alliser is chosen as the new Lord Commander… he hates the wildlings.,Politics
2015-04-12,Season 5,Episode 1,The Wars to Come,sam tarly,All the wildlings.,Politics
2015-04-12,Season 5,Episode 1,The Wars to Come,sam tarly,"It's not a sure thing. Ser Denys Mallister has commanded the Shadow Tower for 20 years, and people say he's a good man. He's running against Ser Alliser--",Politics
2015-04-19,Season 5,Episode 2,The House of Black and White,sam tarly,"Hmm! Did you know that the youngest Lord Commander in history, Osric Stark, was elected at the age of 10?",Politics
2015-04-19,Season 5,Episode 2,The House of Black and White,sam tarly,Your Grace.,Politics
2015-04-19,Season 5,Episode 2,The House of Black and White,sam tarly,But you'd be Lord of Winterfell.,Politics
2015-04-26,Season 5,Episode 3,High Sparrow,petyr baelish,"You're not marrying Roose Bolton. No, you'll be marrying his son and heir, Ramsay. One day he'll be Warden of the North and you will -",Politics
2015-04-26,Season 5,Episode 3,High Sparrow,petyr baelish,"The Lannister name doesn't mean what it once did. Tywin is dead. He kept his house in power through sheer will. Without him, Jaime has one hand and no allies, Tommen is a soft boy, not a king to fear.",Politics
2015-04-26,Season 5,Episode 3,High Sparrow,petyr baelish,"Queen Margaery adores Sansa. Cersei is Queen Mother, a title whose importance wanes with each passing day.",Politics
2015-05-10,Season 5,Episode 5,Kill the Boy,sam tarly,"Ah, Your Grace.",Politics
2015-05-10,Season 5,Episode 5,Kill the Boy,sam tarly,"I am, Your Grace.",Politics
2015-05-10,Season 5,Episode 5,Kill the Boy,sam tarly,"I did, Your Grace.",Politics
2015-05-10,Season 5,Episode 5,Kill the Boy,sam tarly,"I've seen it, Your Grace.",Politics
2015-05-17,Season 5,Episode 6,"Unbowed, Unbent, Unbroken",petyr baelish,I'm here on urgent business for the Queen Mother. Should I send word that I'll be delayed?,Politics
2015-05-17,Season 5,Episode 6,"Unbowed, Unbent, Unbroken",petyr baelish,"Do you think it's wise, your Grace, arresting the heir to Highgarden?",Politics
2015-05-17,Season 5,Episode 6,"Unbowed, Unbent, Unbroken",petyr baelish,Young Lord Robyn heeds my advice. And I have always counseled loyalty to the throne.,Politics
2015-05-17,Season 5,Episode 6,"Unbowed, Unbent, Unbroken",petyr baelish,Marrying his son to the last of the Starks gives him more legitimacy in the North than an alliance with a hated southern house.,Politics
2015-05-17,Season 5,Episode 6,"Unbowed, Unbent, Unbroken",petyr baelish,"You wouldn't risk a single Lannister soldier or a single coin from the Royal Treasury. What do you have to lose, a brothel keeper?",Politics
2015-05-17,Season 5,Episode 6,"Unbowed, Unbent, Unbroken",petyr baelish,Name me Warden of the North.,Politics
2015-05-24,Season 5,Episode 7,The Gift,sam tarly,"Safe travels, Lord Commander.",Politics
2015-05-24,Season 5,Episode 7,The Gift,sam tarly,"His little brother, Aegon. He became king.",Politics
2015-06-14,Season 5,Episode 10,Mother’s Mercy,sam tarly,You were friends with me when I first got here. And I wasn't winning any elections back then.,Politics
2016-05-15,Season 6,Episode 4,Book of the Stranger,petyr baelish,My lord Come and see,Politics
2016-05-15,Season 6,Episode 4,Book of the Stranger,petyr baelish,I missed your name day Go on,Politics
2016-05-15,Season 6,Episode 4,Book of the Stranger,theon greyjoy,I don't want to be king.,Politics
2016-05-15,Season 6,Episode 4,Book of the Stranger,theon greyjoy,You should rule the Iron Islands. Let me help you.,Politics
2016-05-22,Season 6,Episode 5,The Door,theon greyjoy,"And she is your rightful ruler. Those of you that have sailed under her, and there are many of you here, you know what she is.",Politics
2016-05-22,Season 6,Episode 5,The Door,theon greyjoy,We will find no better leader. This is our queen.,Politics
2016-05-29,Season 6,Episode 6,Blood of My Blood,sam tarly,I travelled south under orders from the Lord Commander. He wants me to- -,Politics
2016-06-19,Season 6,Episode 9,Battle of the Bastards,theon greyjoy,Not my claim. Hers.,Politics
2016-06-19,Season 6,Episode 9,Battle of the Bastards,theon greyjoy,I'm not fit to rule.,Politics
2016-06-19,Season 6,Episode 9,Battle of the Bastards,theon greyjoy,There are and Euron is building more. He's going to offer them to you.,Politics
2016-06-19,Season 6,Episode 9,Battle of the Bastards,theon greyjoy,The Iron Fleet isn't all he's bringing. He also wants to give you --,Politics
2016-06-26,Season 6,Episode 10,The Winds of Winter,sam tarly,From Lord Commander Snow at Castle Black.,Politics
2016-06-26,Season 6,Episode 10,The Winds of Winter,sam tarly,I'm-- I'm to be the new maester.,Politics
2016-06-26,Season 6,Episode 10,The Winds of Winter,sam tarly,Maester Aemon became quite ill shortly after the election. He's since passed away. Which is why I'm here.,Politics
2016-06-26,Season 6,Episode 10,The Winds of Winter,sam tarly,"Yes, well, I suppose that life is irregular.",Politics
2017-07-23,Season 7,Episode 2,Stormborn,petyr baelish,"I was sorry when he died. Your father and I had our differences but he loved Cat very much. So did I. She wasn't fond of you, was she? Well, it appears she vastly underestimated you. Your father and brothers are gone, yet here you stand King in the North. Last best hope against the coming storm.",Politics
2017-08-06,Season 7,Episode 4,The Spoils Of War,petyr baelish,"I'm sorry to have disturbed you, Lord Stark.",Politics
2017-08-06,Season 7,Episode 4,The Spoils Of War,theon greyjoy,Euron has her. I came to ask the queen to help get her back.,Politics
2017-08-27,Season 7,Episode 7,The Dragon and the Wolf,petyr baelish,I can't believe he'd surrender the Northern crown without consulting you.,Politics
2017-08-27,Season 7,Episode 7,The Dragon and the Wolf,petyr baelish,"An alliance makes sense. Together, they'd be difficult to defeat. He was named King.",Politics
2019-04-14,Season 8,Episode 1,Winterfell,sam tarly,"Um. Which man am I, Your Grace?",Politics
2019-04-14,Season 8,Episode 1,Winterfell,sam tarly,"Well At least I'll be allowed home again, now that my brother's the lord.",Politics
2019-04-14,Season 8,Episode 1,Winterfell,sam tarly,"Hm. Thank you, Your Grace. For telling me. And m- may I?",Politics
2019-04-14,Season 8,Episode 1,Winterfell,sam tarly,I'm not talking about the King in the North. I'm talking about the King of the bloody Seven Kingdoms.,Politics
2019-04-14,Season 8,Episode 1,Winterfell,sam tarly,"And your father- your real father was Rhaegar Targaryen. You've never been a bastard. You're Aegon Targaryen, true heir to the Iron Throne. I'm sorry, I know it's a lot to take in.",Politics
2019-04-14,Season 8,Episode 1,Winterfell,sam tarly,"No. Your father- Well, Ned Stark. He promised your mother he'd always protect you. And he did. Robert would have murdered you if he knew. You're the true king. Aegon Targaryen, Sixth of His Name, Protector of the Realm, all of it.",Politics
2019-04-14,Season 8,Episode 1,Winterfell,sam tarly,She shouldn't be.,Politics
2019-04-21,Season 8,Episode 2,A Knight of the Seven Kingdoms,theon greyjoy,My queen.,Politics
2019-05-19,Season 8,Episode 6,The Iron Throne,sam tarly,"Um- We represent all the great houses, but whomever we choose, they won't just rule over lords and ladies. Maybe the decision about what's best for everyone should be left to well, everyone.",Politics
2019-05-19,Season 8,Episode 6,The Iron Throne,sam tarly,Your Grace.,Politics
2019-05-19,Season 8,Episode 6,The Iron Throne,sam tarly,Long may he reign.,Politics
